title,location,date,time,price
Learn With Less™ Workshop (Infants 0-12 Months) March 2019,"Strength In Words Headquarters, 94024, CA","Sun, Mar 31",0:15am,Starts at $30.00
 Finnish Music and Playgroup Spring 2019,"The Scandinavian School, San Francisco, CA","Sat, Jan 12",0:00am,Starts at $100.00
Tax Experts at eTax.com will answer your small business tax questions.,"San Francisco, San Francisco, CA","Sun, Mar 31",7:00am,Free
"Candy Drive, Egg Stuffing, & Signage Creation for Easter Love Reach","Memorial Tabernacle Fellowship Hall, Oakland, CA","Sun, Mar 31",2:00pm,Free
ALMADEN VALLEY ATHLETIC CLUB NON-MEMBER TENNIS FEE,"Almaden Valley Athletic Club, San Jose, CA","Mon, Dec 11",7:00pm,Starts at $50.00
Testostérone CODE BLACK - San Francisco,"398 12th St, San Francisco, CA","Sat, Mar 30",9:00pm,Starts at $7.00
Babies and Beyond—Multiple Events Weekly!,"Parents Place Palo Alto, Palo Alto, CA","Sat, Mar 30",1:00pm,
(Free In-Person) Part 1 - EI & Digital Mindfulness: The Truth About Lies | ...,"San Francisco, CA","Sat, Mar 30",6:30pm,Free
"Grant Writing Introductory Training... San Francisco, California		","Online, San Francisco, California","Sun, Mar 31",5:30pm,
Martial Arts Instructor Wanted,"Premier Martial Arts, Elk Grove, CA","Fri, Mar 15",6:00pm,Free
"Grant Writing Introductory Training... Oakland, California			","Oakland, California","Sun, Mar 31",5:30pm,
"Grant Writing Introductory Training... Hayward, California","Online, Hayward, California","Sun, Mar 31",5:30pm,
"Grant Writing Introductory Training... Fremont, California","Online, Fremont, CA","Sun, Mar 31",5:30pm,
Orff Music Class (Mom and Me): 中文奥尔夫音乐早教课-最适合婴幼儿的音乐启蒙课程招生啦！,"Palo Alto Montessori Academy, Palo Alto, CA","Sun, Jan 27",9:00am,
Community Grief Ritual,"Foundation of the Sacred Stream, Berkeley, CA","Sun, Mar 31",0:00am,
"Grant Writing Introductory Training... Concord, California","Online, Concord, California","Sun, Mar 31",5:30pm,
"Grant Writing Introductory Training... San Jose, California	","Online, San Jose,  California","Sun, Mar 31",5:30pm,
"Grant Writing Introductory Training... Sunnyvale, California","Online, Sunnyvale, California","Sun, Mar 31",7:00pm,
"Grant Writing Introductory Training... Santa Clara, California","Online, Santa Clara, California","Sun, Mar 31",5:30pm,
ReThrival Leadership Summit w/Janet Caliri ~ Leading With Alignment,"Sonoma County Healing Academy, Sebastopol, CA","Sat, Mar 30",0:00am,Starts at $497.00
